searchterm,exclude
guitar gibson les paul,guitar
guitar gibson SG,guitar
guitar gibson ES,guitar
guitar gibson "Flying V",guitar
guitar gibson explorer,guitar
guitar gibson firebird,guitar
guitar fender stratocaster, guitar
guitar fender telecaster, guitar
guitar fender jaguar, guitar
guitar fender jazzmaster, guitar
guitar fender mustang, guitar
guitar gretsch streamliner, guitar
guitar gretsch electromatic, guitar
guitar prs se, guitar
guitar prs s2, guitar
guitar prs ce, guitar
guitar rickenbacker solid body, guitar
guitar rickenbacker hollowbody, guitar
guitar yamaha pacifica, guitar
guitar yamaha revstar, guitar
guitar "g&l" asat, guitar
guitar "g&l" comanche, guitar
guitar "g&l" doheny, guitar
guitar "g&l" fallout, guitar
guitar "g&l" legacy, guitar
